{
  "recordId": "voa-learning-english-3947928",
  "sourceId": "voa-learning-english",
  "sourceName": "VOA Learning English",
  "sourceUrl": "https://learningenglish.voanews.com/",
  "title": "Learning English with English Clubs",
  "canonicalUrl": "https://learningenglish.voanews.com/a/learning-english-with-english-clubs-starting-and-organizing-your-club/3947928.html",
  "externalId": "3947928",
  "authors": [
    "Phil Dierking wrote this story for VOA Learning English",
    "Ashley Thompson was the editor"
  ],
  "publishedAt": "2025-03-18",
  "receivedAt": "2026-10-04",
  "contentType": "educational",
  "language": "en",
  "description": "English Clubs are great tools for learning English. Here are tips on how to start and organize your club.",
  "classification": {
    "contentGroup": "articles",
    "primaryCategory": "education",
    "secondaryCategories": [
      "language-learning"
    ]
  },
  "libraryPresentation": {
    "description": "English Clubs are great tools for learning English. Here are tips on how to start and organize your club.",
    "imageReference": null,
    "level": "B1",
    "genre": "Society",
    "readingTime": "5–10 min"
  },
  "rightsStatus": "verified",
  "reuseMode": "verified-full-text",
  "rightsEvidenceUrl": "https://learningenglish.voanews.com/p/6861.html",
  "rightsEvidenceExcerpt": "Learning English texts, MP3s, photos and videos are in the public domain. You are allowed to reprint them for educational and commercial purposes, with credit to learningenglish.voanews.com. However, stories, photos and video images from news agencies such as AP, Reuters and AFP are copyrighted, so you are not allowed to republish them.",
  "attributionRequired": true,
  "attributionText": "Credit to learningenglish.voanews.com",
  "body": "For many English learners, speaking is the most difficult part of the language to master. To improve your speaking skills, you need to be able to practice with other English learners or English speakers.\n\nOne way to do this is by joining – or starting – an English club. In today’s Education Tips, we discuss how English clubs can be helpful to your language-learning process.\n\nThis is part one of a two-part series on English clubs. In this episode, we offer advice for how to start and organize an English club. In next week’s episode, we will suggest some fun and educational activities for your club.\n\nEnglish clubs for language learning\n\nThere are many reasons why English clubs can help learners of all ages and levels improve their English. The most important reason is that they offer learners a chance to practice English by actually speaking it.\n\nThere are other advantages, too. English clubs are less formal than a classroom setting. Many learners find them more fun than usual English classes. They also let learners practice English in more real-life situations. This can increase a learner’s desire to practice and learn on their own.\n\nBonnie Norton and Ernst Von Glasersfeld are learning theory experts. They say that using a language in authentic situations is very important for learners. So is being motivated to practice and improve, they say.\n\nNow that you understand some of the benefits of an English club, let’s discuss how you can create your own club.\n\nStarting an English club\n\nStep 1: Finding club members\n\nThe first step in starting an English club is to find club members. There are different ways to do this.\n\nIf you are a teacher creating the club for your students, then the easiest way is to put up signs in classrooms advertising the club’s first meeting. You can also pass around a sign-up sheet in classes.\n\nIf you are trying to start a club at your place of work, you can advertise your club by sending an email around to coworkers. You can also put up signs about the club around the workplace.\n\nIf your club is open for anyone to join, you can use the internet to find members. Websites such as Meetup or Facebook are great places to announce club meetings and communicate with members.\n\nStep 2 – Find a meeting location\n\nNext, you must find a place for your club to meet. This step is very important. The location of your club will affect how many people come to your meetings. It is important to consider several things when choosing a location.\n\nFirst, how easy is it for members to find and get to the location? It is a good idea to find a central location that is easy to get to. Otherwise, members may slowly stop coming. Second, it is important to find a location that is safe. You want your members to feel comfortable as they are arriving and leaving.\n\nIf you are a teacher, the easiest location is probably in a classroom or another room in the school building. English clubs often meet after school or work hours. This can make it easier to find an available room.\n\nIf you are creating an English club outside of a class or work setting, consider holding meetings at a cafe, restaurant or bar. These places often have enough space for large groups. Club members coming straight from school or work will also have a chance to eat or drink something.\n\nWherever you meet, make sure to speak with the owners of the business or building and get their permission.\n\nStep 3 – Holding your first meeting\n\nThe third step is to hold your first meeting. The first meeting is important for every English club. It is a good idea to use the first meeting as a chance to talk with members about logistics. This includes how often and where the club will meet, whether or not there will be membership fees, and how the club leadership will work.\n\nClub leadership\n\nClub leadership is one of the most important parts of starting an English club. If you have a good system of leadership, your club has a better chance at lasting.\n\nIf your club is small enough, or more informal, sometimes all you need is one person to lead the club. The main responsibility of the one leader is to organize and lead the meetings. The leader also must communicate information to club members.\n\nHowever, if your club is large, it is a good idea to have a group of people that can help run the club.\n\nThis kind of leadership is useful for many reasons. It divides the amount of work it takes to run a club among several people. It also helps club members practice speaking English with real-life tasks. And, if the members of your club are mostly students, it can help them develop teamwork and leadership skills.\n\nIt is also important to have rules for the leadership system. For example, how long will club leaders hold their positions? How will they transfer power to someone else if they must quit the club? You should consider holding elections to choose new leaders.\n\nWhatever leadership system you choose, the goal of an English club remains the same: to keep your club members motivated to continue participating. So, club leaders should not try to do everything themselves.\n\nIn fact, it is a good idea to give tasks to many different club members. This makes the members feel important. They are more likely to remain committed to the club. And it can increase their desire to learn.\n\nFinal thoughts\n\nEnglish clubs can take many forms and serve many purposes. Following these steps will help any club have a successful start.\n\nJoin us next week as we talk about fun and creative activities to do with your newly formed English club.\n\nI’m Jill Robbins. And I’m Phil Dierking.\n\nPhil Dierking wrote this story for VOA Learning English. Ashley Thompson was the editor.\n\nHello readers! For part two in this series on English clubs, we would love to hear about your experiences and ideas for club activities. We are looking for people who are either in an English club or have had experience with one, or have started an English club. If you fit this description and would like to answer a few questions about your experience for our article, please let us know in the comments section below, or on our Facebook page, and we will get in touch with you. Thanks!\n\nWords in This Story\n\nadvantage – n. something (such as a good position or condition) that helps to make someone or something better or more likely to succeed than others\n\nauthentic – adj. real or genuine\n\nbenefit – n. a good or helpful result or effect\n\nclub – n. a group of people who meet to participate in an activity\n\ncommitted – adj. willing to give your time, energy, etc., to something\n\nlogistics – n. the things that must be done to plan and organize a complicated activity or event that involves many people\n\nmotivation – n. the act or process of giving someone a reason for doing something\n\ntask – n. a piece of work that has been given to someone",
  "mediaAssets": [],
  "reviewStatus": "received",
  "reviewNotes": [
    "Official VOA article page inspected. Phil Dierking is credited as writer for VOA Learning English; Ashley Thompson is credited as editor.",
    "The article asks readers to submit comments for a future part-two story but contains no reader-submitted answers; no user-submitted material is included as article content.",
    "No third-party agency credit or third-party media is included in the imported text. No images or media are imported.",
    "B1 is a Library-level editorial mapping for this English-learning instructional article, not a claimed formal CEFR label. Reading time is mapped from full-text word count at 200 WPM."
  ]
}
