{
  "recordId": "voa-learning-english-8003108",
  "sourceId": "voa-learning-english",
  "sourceName": "VOA Learning English",
  "sourceUrl": "https://learningenglish.voanews.com/",
  "title": "'Watching the Grass Grow' Is Not Fun",
  "canonicalUrl": "https://learningenglish.voanews.com/a/watching-the-grass-grow-is-not-fun/8003108.html",
  "externalId": "8003108",
  "authors": [
    "Anna Matteo (VOA Learning English)"
  ],
  "publishedAt": "2025-03-15",
  "receivedAt": "2026-10-04",
  "contentType": "educational",
  "language": "en",
  "description": "Spring is an exciting time, but watching grass grow in any season is not something people want to be doing. Find out what it means when people say something is “like watching grass grow.”",
  "classification": {
    "contentGroup": "articles",
    "primaryCategory": "language-learning"
  },
  "libraryPresentation": {
    "description": "Spring is an exciting time, but watching grass grow in any season is not something people want to be doing. Find out what it means when people say something is “like watching grass grow.”",
    "imageReference": null,
    "level": "B1",
    "genre": "Society",
    "readingTime": "Under 3 min"
  },
  "rightsStatus": "verified",
  "reuseMode": "verified-full-text",
  "rightsEvidenceUrl": "https://learningenglish.voanews.com/p/6861.html",
  "rightsEvidenceExcerpt": "Learning English texts, MP3s, photos and videos are in the public domain. You are allowed to reprint them for educational and commercial purposes, with credit to learningenglish.voanews.com. However, stories, photos and video images from news agencies such as AP, Reuters and AFP are copyrighted, so you are not allowed to republish them.",
  "attributionRequired": true,
  "attributionText": "Credit to learningenglish.voanews.com",
  "body": "And now Words and Their Stories from VOA Learning English.\n\nSpringtime is a time of renewal and growth. Many plants end their long winter sleep and form new buds and shoots. Beautiful flowers will soon be showing their bright colors. And the grass will grow thicker and greener again.\n\nSome flowers bloom in a very noticeable way but that is not the case with grass. Imagine you are sitting in a grassy field. And you have only one job – to watch the grass grow. That does not sound very interesting. In fact, it sounds really boring.\n\nThat idea is what gives us the expression “like watching grass grow.” We use this expression to describe an experience that is uninteresting. Another good word to describe it is “tedious.”\n\nWe use this expression in many situations. Let’s hear a few examples:\n\n“After the politician won his campaign, he gave a two-hour long acceptance speech. Two hours! It was as much fun as watching grass grow.”\n\n“I really don’t like watching long sports games. It’s like watching grass grow.”\n\nNow, grass grows on the ground all the time. And usually, we don’t give it much thought. If you stand in one place for a long time, the grass will continue to grow under your feet.\n\nFor people who are always active, always moving, always on-the-go, we can say they don't let grass grow under their feet. We can also say beneath their feet. And sometimes we use this expression as a command.\n\nLet’s hear some examples:\n\n“Don’t let the grass grow beneath your feet. Get back to work.”\n\n“She certainly doesn’t let the grass grow under her feet. She’s been traveling non-stop for over a year.”\n\nAnd that’s all the time we have for this Words and Their Stories. Until next time, I’m Anna Matteo.\n\nAnna Matteo wrote this story for VOA Learning English.\n\nWords in This Story\n\nbud – n. the beginnings of a flower or a leaf on the branch of a plant\n\nshoot – n. new plant growth, especially from seeds or close to the ground as in the case with grass\n\nbloom – v. the opening of a flower\n\nboring – adj. not interesting\ntedious – adj. tiresome because it takes a long time and is repetitive\n\non-the-go – phrase having much high-spirited energy and movement",
  "mediaAssets": [],
  "reviewStatus": "approved",
  "reviewNotes": [
    "Official article page and its complete text were inspected; its closing author credit states that Anna Matteo wrote this story for VOA Learning English.",
    "No AP, Reuters, AFP, or other third-party copyright credit appears in the inspected title, byline, attribution, or article text; no media assets are included.",
    "The VOA Intermediate Level program listing and the article's language-learning vocabulary support the Library's B1 presentation level; this is a Library taxonomy mapping, not a claim of an explicit VOA CEFR label.",
    "Reading duration is calculated from the complete imported source text, including its vocabulary notes: 399 words at 200 words per minute maps to Under 3 min."
  ]
}
