{
  "recordId": "voa-learning-english-7980848",
  "sourceId": "voa-learning-english",
  "sourceName": "VOA Learning English",
  "sourceUrl": "https://learningenglish.voanews.com/",
  "title": "How to Dish Up Something Good",
  "canonicalUrl": "https://learningenglish.voanews.com/a/how-to-dish-up-something-good/7980848.html",
  "externalId": "7980848",
  "authors": [
    "Anna Matteo wrote this story for VOA Learning English"
  ],
  "publishedAt": "2025-03-01",
  "receivedAt": "2026-10-04",
  "contentType": "educational",
  "language": "en",
  "description": "A dish is more than something you put food on. Find out about different uses of the term on this Words and Their Stories program.",
  "classification": {
    "contentGroup": "articles",
    "primaryCategory": "language-learning",
    "secondaryCategories": [
      "food",
      "culture"
    ]
  },
  "libraryPresentation": {
    "description": "A dish is more than something you put food on. Find out about different uses of the term on this Words and Their Stories program.",
    "imageReference": null,
    "level": "B1",
    "genre": "Society",
    "readingTime": "Under 3 min"
  },
  "rightsStatus": "verified",
  "reuseMode": "verified-full-text",
  "rightsEvidenceUrl": "https://learningenglish.voanews.com/p/6861.html",
  "rightsEvidenceExcerpt": "Learning English texts, MP3s, photos and videos are in the public domain. You are allowed to reprint them for educational and commercial purposes, with credit to learningenglish.voanews.com. However, stories, photos and video images from news agencies such as AP, Reuters and AFP are copyrighted, so you are not allowed to republish them.",
  "attributionRequired": true,
  "attributionText": "Credit to learningenglish.voanews.com",
  "body": "And now, Words and Their Stories, from VOA Learning English.\n\nFood is a popular subject with many people around the world. It is fun to talk about our favorite dishes. It is even more fun to share a favorite dish with others.\n\nToday we talk about the word “dish.” A dish can be the object on which you serve food. But, a dish can also mean a specially prepared food.\n\nDo you have a signature dish? Our signature is how we sign our names. So, a signature dish is a dish we are known for making well. In a way, it identifies us.\n\nMy signature dish is sweet potato rosemary dinner rolls. I am often asked to make them, especially for holiday parties. In my circle of friends, I am known for this dish. When the rolls are on the table, people know that I made them.\n\nA tasty dish is something that makes a table look good and inviting. Sometimes the same can be said about a person. Someone who is good-looking can be called a dish. While this usage might be a bit dated, it is still used.\n\nNow, let’s talk about the verb “dish.”\n\n“To dish” can mean to talk about private or personal information. It might be gossip. But I can also dish about myself. For example, a friend may ask me to dish about my new job.\n\nI could also use a phrasal verb form and say my friend wants me to dish out all the interesting details.\n\nNow, to dish up something means to put food on a dish for someone to eat. However, it can also mean sharing personal details, our own and others.\n\nWe can also dish out things, like jokes or even insults.\n\nSome people like to tease or insult. They can dish out jokes and insults all day long. But sometimes these same people do not like it if you do the same to them.\n\nWe have a saying for just such people. We say, “They can dish it out, but they can’t take it.” They are able and willing to share harsh thoughts, criticisms, or insults about others, but they do not think they, themselves, deserve such treatment.\n\nAnd that’s Words and Their Stories. Until next time, I’m Anna Matteo.\n\nAnna Matteo wrote this story for VOA Learning English.\n\nWords in This Story\n\nsignature – n. the name of a person written with his or her own hand\n\ngossip – n. rumor or report of a personal nature\n\ntease – v. to make fun of\n\nharsh – adj. excessively critical or negative",
  "mediaAssets": [],
  "reviewStatus": "received",
  "reviewNotes": [
    "Official article page inspected. Its closing credit states that Anna Matteo wrote the story for VOA Learning English.",
    "The page contains a photo credited to Drew Angerer/AFP; that third-party image and its caption are excluded. No image or media asset is included in this package.",
    "No third-party agency text or attribution appears in the imported article body. Text-only reuse is evaluated under the VOA Learning English policy.",
    "B1 is a Library-level editorial mapping for this English-learning instructional article, not a claimed formal CEFR label. Reading time is mapped from full-text word count at 200 WPM."
  ]
}
