{
  "recordId": "voa-learning-english-7940837",
  "sourceId": "voa-learning-english",
  "sourceName": "VOA Learning English",
  "sourceUrl": "https://learningenglish.voanews.com/",
  "title": "Sometimes We 'Spread Ourself Too Thin'",
  "canonicalUrl": "https://learningenglish.voanews.com/a/sometimes-we-spread-ourself-too-thin-/7940837.html",
  "externalId": "7940837",
  "authors": [
    "Anna Matteo wrote this story for VOA Learning English"
  ],
  "publishedAt": "2025-01-25",
  "receivedAt": "2026-10-04",
  "contentType": "educational",
  "language": "en",
  "description": "This week on Words and Their Stories, we talk about expressions describing taking on too much. We cannot always add to our list of things to do.",
  "classification": {
    "contentGroup": "articles",
    "primaryCategory": "language-learning",
    "secondaryCategories": [
      "psychology",
      "society"
    ]
  },
  "libraryPresentation": {
    "description": "This week on Words and Their Stories, we talk about expressions describing taking on too much. We cannot always add to our list of things to do.",
    "imageReference": null,
    "level": "B1",
    "genre": "Society",
    "readingTime": "Under 3 min"
  },
  "rightsStatus": "verified",
  "reuseMode": "verified-full-text",
  "rightsEvidenceUrl": "https://learningenglish.voanews.com/p/6861.html",
  "rightsEvidenceExcerpt": "Learning English texts, MP3s, photos and videos are in the public domain. You are allowed to reprint them for educational and commercial purposes, with credit to learningenglish.voanews.com. However, stories, photos and video images from news agencies such as AP, Reuters and AFP are copyrighted, so you are not allowed to republish them.",
  "attributionRequired": true,
  "attributionText": "Credit to learningenglish.voanews.com",
  "body": "And now, Words and Their Stories, from VOA Learning English.\n\nToday we talk about our busy lives. Many people have family and work responsibilities. We might have religious or community activities. Taking care of our health is also important. And let’s not forget about our personal projects, our interests, and our friendships.\n\nWith everything on our plate, it is easy to feel overwhelmed, overextended, and overcommitted.\n\nHowever, if we try to do too much, we may spread ourselves too thin. This expression means we have taken on too much. We are pushed to the limit.\n\nPeople who are spread too thin, take on too many jobs, projects, or goals. The heavy load requires more energy or attention than they possess.\n\nIf we work on many projects simultaneously, or at the same time, it is possible that none will get done well, if they get done at all. And it is possible such multitasking could stress us out.\n\nBeing spread too thin can also be described as biting off more than we can chew. When we bite off more than we can chew, we attempt to do more than is possible.\n\nHere is a VOA Learning English English in a Minute video explaining the idiom “to bite off more than you can chew.”\n\nNow, let’s hear these some of these terms and expressions used in a conversation.\n\nA: So, how are your classes going?\n\nB: Not great. Many of my best students are failing my course. They all missed an important deadline for a project.\n\nA: That's strange. What else do they have going on?\n\nB: A lot! They are all performing in the same play. So, they have had rehearsals every night for the past month. And many have part-time jobs as well.\n\nA: Sounds like they’ve spread themselves too thin. They’ve got too much going on.\n\nB: I think you’re right.\n\nA: So, what are you going to do?\n\nB: Well, first I’ll extend the deadline. And then I’m going to warn them about biting off more than they can chew.\n\nAnd that’s all the time we have for this Words and Their Stories.\n\nUntil next time, I’m Anna Matteo.\n\nAnna Matteo wrote this story for VOA Learning English.\n\nWords in This Story\n\noverwhelmed – adj. overcome or overpowered by force, number, thought or feeling\n\novercommitted – adj. to be obligated to something beyond the ability for fulfillment\n\nmultitasking – n. the performance of several tasks at one time\n\nstress – v. to subject to physical or psychological pressure\n\nconversation – n. talking or a talk between two or more people\n\nrehearsal – n. a private performance or practice session in preparation for a public appearance",
  "mediaAssets": [],
  "reviewStatus": "received",
  "reviewNotes": [
    "Official article page inspected. Its closing credit states that Anna Matteo wrote the story for VOA Learning English.",
    "The body references an English in a Minute VOA video; no video or other media is copied or included. No third-party copyright credit appears in the inspected article text.",
    "B1 is a Library-level editorial mapping for this English-learning instructional article, not a claimed formal CEFR label. Reading time is mapped from full-text word count at 200 WPM."
  ]
}
