{
  "recordId": "voa-learning-english-7979814",
  "sourceId": "voa-learning-english",
  "sourceName": "VOA Learning English",
  "sourceUrl": "https://learningenglish.voanews.com/",
  "title": "The Importance of Being 'Dialed In'",
  "canonicalUrl": "https://learningenglish.voanews.com/a/the-importance-of-being-dialed-in-/7979814.html",
  "externalId": "7979814",
  "authors": [
    "Anna Matteo wrote this story for VOA Learning English"
  ],
  "publishedAt": "2025-02-22",
  "receivedAt": "2026-10-04",
  "contentType": "educational",
  "language": "en",
  "description": "English has several expressions that come from older technology. Today, we explore \"dialing in,\" \"tuning in,\" and \"moving the needle.\"",
  "classification": {
    "contentGroup": "articles",
    "primaryCategory": "language-learning",
    "secondaryCategories": [
      "technology"
    ]
  },
  "libraryPresentation": {
    "description": "English has several expressions that come from older technology. Today, we explore \"dialing in,\" \"tuning in,\" and \"moving the needle.\"",
    "imageReference": null,
    "level": "B1",
    "genre": "Society",
    "readingTime": "Under 3 min"
  },
  "rightsStatus": "verified",
  "reuseMode": "verified-full-text",
  "rightsEvidenceUrl": "https://learningenglish.voanews.com/p/6861.html",
  "rightsEvidenceExcerpt": "Learning English texts, MP3s, photos and videos are in the public domain. You are allowed to reprint them for educational and commercial purposes, with credit to learningenglish.voanews.com. However, stories, photos and video images from news agencies such as AP, Reuters and AFP are copyrighted, so you are not allowed to republish them.",
  "attributionRequired": true,
  "attributionText": "Credit to learningenglish.voanews.com",
  "body": "And now, Words and Their Stories, from VOA Learning English.\n\nTechnology is always progressing. Today, many modern devices can be controlled by touch or voice. This has led to some traditional electronic controls – such as dials and switches – being replaced with new technologies.\n\nDigital displays have also become increasingly common. For example, digital number readouts have long replaced the hands on many clocks.\n\nMany other devices also now operate purely with digital tools instead of mechanical systems.\n\nBut some expressions and idioms used by English speakers still describe older technologies.\n\nFirst, let’s talk about dials. These controls are used for changing settings on a piece of equipment, like a radio or old television. We use the dial to tune in to a specific channel.\n\nThat’s where the expressions dialed in and tuned in come from. If we are dialed in or tuned in to a radio or television program, we can hear it clearly. There is no noise or static.\n\nThe same can be said when using these terms in personal conversations. For example, if you are dialed in to a project or problem, you know exactly what needs to be done. You are thinking clearly about it and remain very focused.\n\nAnd when you are tuned in, you understand clearly what is going on around you.\n\n“Don’t touch that dial” and “stay tuned” are two ways to tell someone to keep watching or listening to a program.\n\nNow, let’s talk about switches.\n\nThese are built to either be off or on. There are no in-between settings like with a dial. So, when we flip the switch, we make something happen quickly and easily. It can also mean that we suddenly change something.\n\nLet’s listen to an example.\n\n“The restaurant’s change to all organic food happened slowly over time. It wasn’t a matter of flipping a switch.”\n\nNow, for our last expression -- to move the needle.\n\nNeedles on measuring devices like a scale move to show a desired level has been reached. So, when something moves the needle, it causes a noticeable change in something, usually for the good.\n\nAnd that’s all the time we have for this Words and Their Stories. Don't forget to tune in again for another story about American English expressions.\n\nUntil next time, I’m Anna Matteo.\n\nAnna Matteo wrote this story for VOA Learning English.\n\nWords in This Story\n\ndial – n. a device that may be operated to make electrical connections or to regulate the operation of a machine\n\nswitch – n. a device for making, breaking, or changing the connections in an electrical circuit\n\nreplace – v. to take the place of, especially as a substitute\n\ndigital – adj. of, relating to, or using calculation directly with digits rather than through measurable physical quantities\n\ndisplay – n. an electronic device that gives information in visual form\n\ntune in – phrasal verb to listen to or view a broadcast of\n\nstatic – n. noise produced in a radio or television receiver by atmospheric or electrical disturbances\n\nconversation – n. talking or a talk between two or more people\n\nfocus – v. to cause to be concentrated\n\nflip – v. to move with a small quick motion\n\nneedle – n. a slender pointer on a dial; a slender bar of magnetized steel that is free to turn (as in a compass) to show the direction of a magnetic field\n\nscale – n. a device for weighing",
  "mediaAssets": [],
  "reviewStatus": "received",
  "reviewNotes": [
    "Official article page inspected. Its closing credit states that Anna Matteo wrote the story for VOA Learning English.",
    "No AP, Reuters, AFP, or other third-party copyright credit appears in the inspected article text. No media assets are imported.",
    "B1 is a Library-level editorial mapping for this English-learning instructional article, not a claimed formal CEFR label. Reading time is mapped from full-text word count at 200 WPM."
  ]
}
