{
  "recordId": "voa-learning-english-5649722",
  "sourceId": "voa-learning-english",
  "sourceName": "VOA Learning English",
  "sourceUrl": "https://learningenglish.voanews.com/",
  "title": "How to Write a Good Email",
  "canonicalUrl": "https://learningenglish.voanews.com/a/how-to-write-a-good-email/5649722.html",
  "externalId": "5649722",
  "authors": [
    "Gregory Stachel wrote this story for VOA Learning English",
    "George Grow was the editor"
  ],
  "receivedAt": "2026-10-04",
  "contentType": "educational",
  "language": "en",
  "description": "A practical lesson on writing effective emails, covering subject lines, greetings, message organization, tone, and sign-offs.",
  "classification": {
    "primaryCategory": "career",
    "contentGroup": "articles",
    "secondaryCategories": [
      "education",
      "language-learning"
    ]
  },
  "libraryPresentation": {
    "description": "A practical lesson on writing effective emails, covering subject lines, greetings, message organization, tone, and sign-offs.",
    "imageReference": null,
    "level": "B1",
    "genre": "Business & Economics",
    "readingTime": "5–10 min"
  },
  "rightsStatus": "verified",
  "reuseMode": "verified-full-text",
  "rightsEvidenceUrl": "https://learningenglish.voanews.com/p/6861.html",
  "rightsEvidenceExcerpt": "Learning English texts, MP3s, photos and videos produced by VOA are public domain. You are allowed to reprint them for educational and commercial purposes, with credit to learningenglish.voanews.com. However, stories, photos and video images from news agencies such as AP, Reuters and AFP are copyrighted, so you are not allowed to republish them.",
  "attributionRequired": true,
  "attributionText": "Credit to learningenglish.voanews.com",
  "reviewStatus": "needs-quality-review",
  "reviewNotes": [
    "The official VOA Learning English page and complete visible article text were inspected on 2026-10-04.",
    "The page credits Gregory Stachel as the VOA Learning English writer and George Grow as editor. No AP, Reuters, AFP, or other third-party copyright credit was found in the article text or byline.",
    "No image or other media asset is retained; imageReference is null because item-level media rights were not verified.",
    "The conditional VOA producer grant is supported by the recorded official policy excerpt and the required VOA attribution. The verified full-text status is subject to the conditional grant validator.",
    "B1 is an editorial level estimate based on the article's language, not an official VOA CEFR designation.",
    "Reading time uses 822 words at 200 words per minute (about 4.1 minutes), mapped to the existing 5–10 min category."
  ],
  "body": "Email is one of the most important ways through which we communicate. It has become part of most everyone’s day-to-day life.\n\nWriting a good email can mean the difference between someone reading it and writing back, and someone ignoring it all together. Do you have questions on how to make your message more effective?\n\nToday on Education Tips, we will answer the question, “How can I make my emails better?”\n\nEmails are made up of four different parts:\n\n- the subject line,\n- the opening,\n- the body, and\n- the closing.\n\nLet us explore how to make each of these parts better.\n\nSubject line\n\nThe subject line is what the other person, or receiver, will read first. The subject line is usually the most important part of an email. It should be short but contain enough details that the receiver recognizes the subject of the email. A good subject line sets the expectations for the email. A bad subject line can mean the receiver will not read the email.\n\nSome people will add the word “important” to the subject line, but this does not provide enough information. Instead of writing “important,” two better choices for subject lines are:\n\nMeeting Tomorrow at 10am to Discuss New Changes\nQuestion About Future Classes\n\nOpening an email\n\nAs in any form of writing, you should know your audience. The opening of an email depends on things like how formal the relationship is.\n\nIf you are sending an email to a friend or someone you work with, two good openings or greetings are:\n\nGood Morning/Afternoon,\nHello, or Hello [name],\n\nIf you are sending the email to someone you do not know and it is a formal situation, some possible openings are:\n\nDear [name of department],\nTo Whom it May Concern,\n\nIn a formal situation, when you know the name of the person, a good opening is simply:\n\nDear [title] [family name],\nAs in, Dear Mister Brown,\n\nBody\n\nThe body of the email is where you ask for what you need or make clear your reason for writing the email. This could be asking them a question or keeping them informed. The body of the email should prioritize the most important information. It should be direct, and it is wise to keep it short.\n\nIf the person you are emailing does not know you, you should introduce yourself in the first few lines. You might write:\n\nMy name is Patricia Jones. I am sending this email to get some more information about the job you advertised.\n\nAfter you have introduced yourself and given your reason for writing, you can follow this with the body of your email. The most important information should come first. This makes your email clear to your receiver and saves them time. Here is an example.\n\nI wanted to know if you are currently accepting applications. If so, where can I send my information? Additionally, will you be meeting people in-person or online?\n\nIt is important to clearly explain yourself in as few words as possible. Try to keep your email short, but polite. This is important because you want to make yourself clear to your receiver.\n\nClosings\n\nThe last part to a good email is the closing. It is usually one or two words that let the receiver know that this is the end of the email. The ending should include your name and tell the receiver where you work and what you do. A few different closings are:\n\nKind regards,\nBest,\nThank you,\n\nSome applications create an automatic signature for the sender. This is useful because it saves time when you are writing.\n\nExample email\n\nSo, what does a completed email look like? Here is an example email:\n\nIf you follow these suggestions, you will find that you receive more responses to your emails. Effective email writing is important especially now when so much of what we do is online.\n\nI’m Gregory Stachel.\n\nAnd I’m Jill Robbins.\n\nGregory Stachel wrote this story for VOA Learning English. George Grow was the editor.\n\nWords in This Story\n\naudience – n. the people who watch, read, or listen to something\n\nformal – adj. of language: suitable for serious or official speech and writing\n\nprioritize – v. to make (something) the most important thing in a group\n\nintroduce – v. to make (someone) known to someone else by name\n\napplication – n. formal and usually written request for something (such as a job, admission to a school, a loan, or such)\n\npolite – adj. having or showing good manners or respect for other people\n\nautomatic – adj. of a machine or device: having controls that allow something to work or happen without being directly controlled by a person\n\nsignature – n. a person's name written in that person's handwriting or, on an electronic message, the person’s name and other contact information\n\nresponse – n. something that is said or written as a reply to something"
}
